{
  "codigo": "SK - 32",
  "autor": "Daza Gutierrez, Aldo Luis Junior",
  "formato": "GE-732 Tipo Skarn",
  "fuente_pdf": "YACIMIENTO_SKARN.pdf",
  "pagina": 1,
  "mineralogia_texturas": [
    {
      "mineral": "Actinolita",
      "pct": "90",
      "texturas": "Masivo - reemplazamiento",
      "observaciones": "Propio de alteracion retrograda de un skarn"
    },
    {
      "mineral": "Pirita",
      "pct": "10",
      "texturas": "Diseminado",
      "observaciones": ""
    }
  ],
  "esquema": {
    "descripcion": "Dibujo de la muestra de color verde uniforme (actinolita) con una mancha turquesa central senalada como actinolita y puntos amarillos de pirita a la izquierda.",
    "escala": "",
    "imagen": ""
  },
  "ensambles_alteracion": [
    {
      "mineral": "Actinolita",
      "pct": "90",
      "intensidad": "moderada",
      "observaciones": ""
    },
    {
      "mineral": "Pirita",
      "pct": "10",
      "intensidad": "incipiente",
      "observaciones": "Diseminado"
    }
  ],
  "ensambles_proximal_distal": [
    {
      "mineral": "Actinolita",
      "pct": "70",
      "asociacion": "distal",
      "observaciones": ""
    }
  ],
  "secuencia_paragenetica": {
    "descripcion": "Actinolita primero y pirita despues.",
    "eventos": [
      {
        "mineral": "Actinolita",
        "etapa": "",
        "notas": ""
      },
      {
        "mineral": "Pirita",
        "etapa": "",
        "notas": ""
      }
    ]
  },
  "interpretacion": {
    "protolito": "",
    "alteraciones": "Fase retrograda",
    "condiciones_fq": "Baja temperatura; pH basico",
    "tipo_yacimiento": "Skarn"
  },
  "confianza": "alta",
  "notas_transcripcion": "Escaneo de hoja manuscrita, leido con vision. Cada muestra ocupa dos paginas consecutivas (anverso con las secciones 1-3 y reverso con las 4-6). El campo 'pagina' apunta al anverso, que es la imagen guardada en page.jpg. Reverso de esta muestra: pagina 2. La actinolita figura con 90 % en las tablas 1 y 2, pero con 70 % en la tabla proximal/distal. La casilla Protolito quedo vacia."
}
