{
  "codigo": "PCM - 18",
  "autor": "Chavez Huamancha, Marlon Christopher",
  "formato": "GE-732 Tipo Porfido",
  "fuente_pdf": "PORFIDOS_MUESTRAS.pdf",
  "pagina": 19,
  "mineralogia_texturas": [
    {
      "mineral": "Clorita",
      "pct": "70",
      "texturas": "Masivo",
      "observaciones": ""
    },
    {
      "mineral": "Epidota",
      "pct": "15",
      "texturas": "Masivo",
      "observaciones": "Color verde botella"
    },
    {
      "mineral": "Silice",
      "pct": "5",
      "texturas": "Masivo",
      "observaciones": ""
    },
    {
      "mineral": "Pirita",
      "pct": "5",
      "texturas": "Diseminado",
      "observaciones": ""
    },
    {
      "mineral": "Calcopirita",
      "pct": "5",
      "texturas": "Masivo",
      "observaciones": ""
    }
  ],
  "esquema": {
    "descripcion": "Dibujo de la muestra con dos familias de venillas entrecruzadas (tipo D en rojo y tipo A en naranja) y granos de clorita y epidota senalados.",
    "escala": "cm (barra sin valor)",
    "imagen": ""
  },
  "ensambles_alteracion": [
    {
      "mineral": "Clorita",
      "pct": "70",
      "intensidad": "moderada",
      "observaciones": ""
    },
    {
      "mineral": "Epidota",
      "pct": "15",
      "intensidad": "moderada",
      "observaciones": ""
    }
  ],
  "venillas": [
    {
      "tipo": "Tipo A",
      "espesor_mm": "2",
      "asociaciones": "Silice gris",
      "observaciones": ""
    },
    {
      "tipo": "Tipo D",
      "espesor_mm": "2",
      "asociaciones": "Pirita + calcopirita",
      "observaciones": ""
    }
  ],
  "secuencia_paragenetica": {
    "descripcion": "De mayor a menor temperatura: silice, clorita, epidota, calcopirita y pirita.",
    "eventos": [
      {
        "mineral": "Silice",
        "etapa": "",
        "notas": ""
      },
      {
        "mineral": "Clorita",
        "etapa": "",
        "notas": ""
      },
      {
        "mineral": "Epidota",
        "etapa": "",
        "notas": ""
      },
      {
        "mineral": "Calcopirita",
        "etapa": "",
        "notas": ""
      },
      {
        "mineral": "Pirita",
        "etapa": "",
        "notas": ""
      }
    ]
  },
  "interpretacion": {
    "protolito": "",
    "alteraciones": "Propilitico",
    "condiciones_fq": "pH basico; temperatura moderada",
    "tipo_yacimiento": "Porfido de cobre"
  },
  "confianza": "alta",
  "notas_transcripcion": "Escaneo de hoja manuscrita, leido con vision. Cada muestra ocupa dos paginas (anverso con las secciones 1-3 y reverso con las 4-6), pero el PDF NO las trae consecutivas: el emparejamiento se reconstruyo por contenido. El campo 'pagina' apunta al anverso (el que lleva el codigo) y es la imagen guardada en page.jpg. Reverso de esta muestra: pagina 18. La casilla Protolito quedo en blanco. En la tabla 3 las asociaciones del tipo D figuran como 'PY + CP'."
}
