{
  "codigo": "SK - 05",
  "autor": "Chavez Huamancha, Marlon Christopher",
  "formato": "GE-732 Tipo Skarn",
  "fuente_pdf": "SKARN_MUESTRAS.pdf",
  "pagina": 7,
  "mineralogia_texturas": [
    {
      "mineral": "Wollastonita",
      "pct": "40",
      "texturas": "Bandas y reemplazamiento",
      "observaciones": "Reemplazando al hornfels"
    },
    {
      "mineral": "Sulfuros",
      "pct": "30",
      "texturas": "Diseminado",
      "observaciones": "Diseminado sobre la wollastonita"
    }
  ],
  "esquema": {
    "descripcion": "Dibujo circular (vista de lupa) de fondo anaranjado (wollastonita) atravesado por bandas azul-verdosas verticales y sinuosas (sulfuros).",
    "escala": "",
    "imagen": ""
  },
  "ensambles_alteracion": [
    {
      "mineral": "Wollastonita",
      "pct": "40",
      "intensidad": "incipiente",
      "observaciones": "Reemplazando al hornfels"
    }
  ],
  "ensambles_proximal_distal": [
    {
      "mineral": "Wollastonita",
      "pct": "40",
      "asociacion": "distal",
      "observaciones": "Grano fino en reemplazamiento"
    }
  ],
  "secuencia_paragenetica": {
    "descripcion": "Wollastonita primero y sulfuros despues.",
    "eventos": [
      {
        "mineral": "Wollastonita",
        "etapa": "",
        "notas": ""
      },
      {
        "mineral": "Sulfuros",
        "etapa": "",
        "notas": ""
      }
    ]
  },
  "interpretacion": {
    "protolito": "Caliza",
    "alteraciones": "Skarn - fase prograda",
    "condiciones_fq": "Altas temperaturas; pH basico",
    "tipo_yacimiento": "Skarn"
  },
  "confianza": "alta",
  "notas_transcripcion": "Escaneo de hoja manuscrita, leido con vision. Cada muestra ocupa dos paginas (anverso con las secciones 1-3 y reverso con las 4-6) y el PDF NO las trae consecutivas: el emparejamiento se reconstruyo por contenido. El campo 'pagina' apunta al anverso (el que lleva el codigo) y es la imagen guardada en page.jpg. Reverso de esta muestra: pagina 10. Ojo: existe ademas una muestra 'SK - 5' de Aguilar Peralta (carpeta SK-5), que es otra muestra distinta."
}
