{
  "codigo": "SK - 06",
  "autor": "Daza Gutierrez, Aldo Luis Junior",
  "formato": "GE-732 Tipo Skarn",
  "fuente_pdf": "YACIMIENTO_SKARN.pdf",
  "pagina": 13,
  "mineralogia_texturas": [
    {
      "mineral": "Granate",
      "pct": "70",
      "texturas": "Granulares",
      "observaciones": "Verde claro, de grano grueso"
    },
    {
      "mineral": "Esfalerita",
      "pct": "30",
      "texturas": "Masivo",
      "observaciones": "Parduzco"
    }
  ],
  "esquema": {
    "descripcion": "Dibujo de la muestra de contorno redondeado, con matriz gris (esfalerita) y masas verdes de granate en el centro.",
    "escala": "2 cm",
    "imagen": ""
  },
  "ensambles_alteracion": [
    {
      "mineral": "Granate",
      "pct": "70",
      "intensidad": "incipiente",
      "observaciones": "Verduzco claro"
    }
  ],
  "ensambles_proximal_distal": [
    {
      "mineral": "Granate",
      "pct": "70",
      "asociacion": "distal",
      "observaciones": "Reemplaza al mineral oscuro"
    }
  ],
  "secuencia_paragenetica": {
    "descripcion": "Granate primero y esfalerita despues.",
    "eventos": [
      {
        "mineral": "Granate",
        "etapa": "",
        "notas": ""
      },
      {
        "mineral": "Esfalerita",
        "etapa": "",
        "notas": ""
      }
    ]
  },
  "interpretacion": {
    "protolito": "",
    "alteraciones": "Skarn - prograda",
    "condiciones_fq": "Altas temperaturas; pH basico",
    "tipo_yacimiento": "Skarn"
  },
  "confianza": "alta",
  "notas_transcripcion": "Escaneo de hoja manuscrita, leido con vision. Cada muestra ocupa dos paginas consecutivas (anverso con las secciones 1-3 y reverso con las 4-6). El campo 'pagina' apunta al anverso, que es la imagen guardada en page.jpg. Reverso de esta muestra: pagina 14. ATENCION: el codigo 'SK-06' ya lo usa una muestra de Chavez Huamancha (SKARN_MUESTRAS.pdf p9), que es otra muestra; por eso esta se guarda en SK-06-b. Es la misma muestra que SK-02 de Chavez Huamancha (SKARN_MUESTRAS.pdf p1, carpeta SK-02-b): esfalerita 30 y granate 70. En la tabla proximal/distal figura 'distral'. La casilla Protolito quedo vacia."
}
