{
  "codigo": "MA-T-49",
  "autor": "Daza Gutierrez, Aldo Luis Junior",
  "fuente_pdf": "MAGMATICOS.pdf",
  "pagina": 8,
  "mineralogia_texturas": [
    {
      "mineral": "Cromita",
      "pct": "80",
      "texturas": "Cataclastica",
      "observaciones": "Son finas y angulosas"
    },
    {
      "mineral": "Serpentina",
      "pct": "20",
      "texturas": "Masiva",
      "observaciones": "Se ve como una arenisca"
    }
  ],
  "esquema": {
    "descripcion": "Muestra con matriz verde de serpentina y fragmentos oscuros angulosos de cromita; superficie meteorizada.",
    "escala": "2 cm",
    "imagen": ""
  },
  "ensambles_alteracion": [
    {
      "mineral": "Serpentina",
      "pct": "20",
      "intensidad": "moderada",
      "observaciones": "Color verde botella"
    }
  ],
  "secuencia_paragenetica": {
    "descripcion": "Cromita primero y serpentina despues.",
    "eventos": [
      {
        "mineral": "Cromita",
        "etapa": "magmatico",
        "notas": ""
      },
      {
        "mineral": "Serpentina",
        "etapa": "alteracion (serpentinizacion)",
        "notas": ""
      }
    ]
  },
  "interpretacion": {
    "protolito": "Roca ultramafica",
    "alteraciones": "Metasomatico",
    "condiciones_fq": "Temperatura intermedia",
    "tipo_yacimiento": "Yacimiento magmatico"
  },
  "confianza": "alta",
  "notas_transcripcion": "La letra central del codigo se lee claramente como 'T' en la escritura de este autor (MA-T-NN). Ojo: en MINAYA_DELGADO_STEVEN.pdf el mismo glifo se viene transcribiendo como 'Y' (MA-Y-NN); podrian ser la misma serie de codigos."
}
