{
  "codigo": "PCM - 14",
  "autor": "Chavez Huamancha, Marlon Christopher",
  "formato": "GE-732 Tipo Porfido",
  "fuente_pdf": "PORFIDOS_MUESTRAS.pdf",
  "pagina": 5,
  "mineralogia_texturas": [
    {
      "mineral": "Clorita",
      "pct": "70",
      "texturas": "Masivo",
      "observaciones": ""
    },
    {
      "mineral": "Cuarzo",
      "pct": "20",
      "texturas": "Masivo",
      "observaciones": ""
    },
    {
      "mineral": "Sericita",
      "pct": "5",
      "texturas": "Masivo",
      "observaciones": ""
    },
    {
      "mineral": "Pirita",
      "pct": "5",
      "texturas": "Diseminado",
      "observaciones": ""
    }
  ],
  "esquema": {
    "descripcion": "Dibujo de la muestra con fondo anaranjado de clorita, atravesado por dos familias de venillas entrecruzadas (tipo C, en celeste, y otra tipo A/B en naranja).",
    "escala": "2 cm",
    "imagen": ""
  },
  "ensambles_alteracion": [
    {
      "mineral": "Clorita",
      "pct": "70",
      "intensidad": "moderada",
      "observaciones": ""
    }
  ],
  "venillas": [
    {
      "tipo": "Tipo C",
      "espesor_mm": "2",
      "asociaciones": "Cuarzo + sericita",
      "observaciones": ""
    },
    {
      "tipo": "Tipo B",
      "espesor_mm": "2",
      "asociaciones": "Cuarzo + pirita",
      "observaciones": ""
    }
  ],
  "secuencia_paragenetica": {
    "descripcion": "De mayor a menor temperatura: cuarzo, clorita, sericita y pirita.",
    "eventos": [
      {
        "mineral": "Cuarzo",
        "etapa": "",
        "notas": ""
      },
      {
        "mineral": "Clorita",
        "etapa": "",
        "notas": ""
      },
      {
        "mineral": "Sericita",
        "etapa": "",
        "notas": ""
      },
      {
        "mineral": "Pirita",
        "etapa": "",
        "notas": ""
      }
    ]
  },
  "interpretacion": {
    "protolito": "",
    "alteraciones": "Propilitica",
    "condiciones_fq": "pH basico; temperaturas moderadas",
    "tipo_yacimiento": "Porfido de Cu"
  },
  "confianza": "alta",
  "notas_transcripcion": "Escaneo de hoja manuscrita, leido con vision. Cada muestra ocupa dos paginas (anverso con las secciones 1-3 y reverso con las 4-6), pero el PDF NO las trae consecutivas: el emparejamiento se reconstruyo por contenido. El campo 'pagina' apunta al anverso (el que lleva el codigo) y es la imagen guardada en page.jpg. Reverso de esta muestra: pagina 2. La casilla Protolito quedo en blanco. En el esquema la segunda venilla se lee 'tipo a' o 'tipo B'; la tabla 3 registra tipo C y tipo B."
}
