{
  "codigo": "P-MC-15",
  "autor": "Aguilar Peralta, Jose Luis",
  "formato": "GE-732 Tipo Porfido",
  "fuente_pdf": "YACIMIENTOS-AGUILAR_PERALTA_JOSE_LUIS.pdf",
  "pagina": 12,
  "mineralogia_texturas": [
    {
      "mineral": "Biotita",
      "pct": "20",
      "texturas": "Grafico-diseminado",
      "observaciones": "Micas oscuras"
    },
    {
      "mineral": "Cuarzo",
      "pct": "20",
      "texturas": "Masiva",
      "observaciones": "Venilla"
    },
    {
      "mineral": "Pirita",
      "pct": "10",
      "texturas": "Diseminada",
      "observaciones": "Pequenos granos incrustados"
    },
    {
      "mineral": "Calcopirita",
      "pct": "15",
      "texturas": "Masiva",
      "observaciones": "Patina atornasolada"
    },
    {
      "mineral": "Feldespato-K",
      "pct": "25",
      "texturas": "Masiva",
      "observaciones": "Blanco a rosa"
    }
  ],
  "esquema": {
    "descripcion": "Fotografia de la muestra de mano con rotulo 'P-MC-015'. Roca porfiritica gris-verdosa con motas negras; etiquetas: cuarzo (venilla clara), feldespato, biotita, sericita y pirita.",
    "escala": "",
    "imagen": ""
  },
  "ensambles_alteracion": [
    {
      "mineral": "Sericita",
      "pct": "10",
      "intensidad": "moderada",
      "observaciones": "Blanquecino"
    }
  ],
  "venillas": [
    {
      "tipo": "Tipo B",
      "espesor_mm": "1-2",
      "asociaciones": "Cuarzo",
      "observaciones": "Venillas entrecruzadas"
    }
  ],
  "secuencia_paragenetica": {
    "descripcion": "De mayor a menor temperatura: feldespato, biotita, sericita, cuarzo, pirita y calcopirita.",
    "eventos": [
      {
        "mineral": "Feldespato",
        "etapa": "",
        "notas": ""
      },
      {
        "mineral": "Biotita",
        "etapa": "",
        "notas": ""
      },
      {
        "mineral": "Sericita",
        "etapa": "",
        "notas": ""
      },
      {
        "mineral": "Cuarzo",
        "etapa": "",
        "notas": ""
      },
      {
        "mineral": "Pirita",
        "etapa": "",
        "notas": ""
      },
      {
        "mineral": "Calcopirita",
        "etapa": "",
        "notas": ""
      }
    ]
  },
  "interpretacion": {
    "protolito": "Granodiorita",
    "alteraciones": "Potasica",
    "condiciones_fq": "pH = 5-7; Temperatura = 400-600 C",
    "tipo_yacimiento": "Porfidos cupriferos"
  },
  "confianza": "alta",
  "notas_transcripcion": "PDF digital (texto seleccionable), no manuscrito: la transcripcion es literal. Hoja del formato 'YACIMIENTOS MINERALES METALICOS (GE-732) - Formato de Descripcion de Muestras Tipo Porfido', que ademas del GE-701 trae una seccion 'Tipo de venillas' (campo venillas). El esquema es una fotografia de la muestra de mano. Grupo del informe: B) Yacimientos tipo porfidos (separador en pagina 10). El rotulo de la foto dice 'P-mC-015'; el recuadro de codigo dice 'P-MC-15'."
}
