{
  "codigo": "MA-T-62",
  "autor": "Daza Gutierrez, Aldo Luis Junior",
  "fuente_pdf": "MAGMATICOS.pdf",
  "pagina": 9,
  "mineralogia_texturas": [
    {
      "mineral": "Cuarzo",
      "pct": "15",
      "texturas": "Masivo",
      "observaciones": "Zona clara"
    },
    {
      "mineral": "Plagioclasa",
      "pct": "15",
      "texturas": "Masivo",
      "observaciones": "Zona clara"
    },
    {
      "mineral": "Serpentina",
      "pct": "70",
      "texturas": "Masivo",
      "observaciones": "Zona oscura"
    }
  ],
  "esquema": {
    "descripcion": "Muestra con fondo verde grisaceo (zonas oscuras de serpentina) y manchas anaranjadas alargadas (zonas claras: cuarzo y posiblemente plagioclasas); se aprecia algo de esquistosidad.",
    "escala": "2 cm",
    "imagen": ""
  },
  "ensambles_alteracion": [
    {
      "mineral": "Serpentina",
      "pct": "70",
      "intensidad": "moderada",
      "observaciones": "Zona oscura"
    },
    {
      "mineral": "Cuarzo",
      "pct": "15",
      "intensidad": "moderada",
      "observaciones": "Zona clara"
    }
  ],
  "secuencia_paragenetica": {
    "descripcion": "Roca caja, luego serpentina y finalmente cuarzo.",
    "eventos": [
      {
        "mineral": "Roca",
        "etapa": "roca caja",
        "notas": ""
      },
      {
        "mineral": "Serpentina",
        "etapa": "alteracion (serpentinizacion)",
        "notas": ""
      },
      {
        "mineral": "Cuarzo",
        "etapa": "posterior",
        "notas": ""
      }
    ]
  },
  "interpretacion": {
    "protolito": "Probablemente haya sido un Gabro, Metagabro o Anfibolita",
    "alteraciones": "Serpentinizacion",
    "condiciones_fq": "Hidratacion del Olivino",
    "tipo_yacimiento": "Yacimiento Magmatico"
  },
  "confianza": "alta",
  "notas_transcripcion": "La letra central del codigo se lee claramente como 'T' en la escritura de este autor (MA-T-NN). Ojo: en MINAYA_DELGADO_STEVEN.pdf el mismo glifo se viene transcribiendo como 'Y' (MA-Y-NN); podrian ser la misma serie de codigos."
}
