{
  "codigo": "M - 7",
  "autor": "Chavez Huamancha, Marlon Christopher",
  "formato": "GE-732 Tipo Porfido",
  "fuente_pdf": "PORFIDOS_MUESTRAS.pdf",
  "pagina": 9,
  "mineralogia_texturas": [
    {
      "mineral": "Pirita",
      "pct": "30",
      "texturas": "Bandeamiento (estratoligado)",
      "observaciones": "En bandas distribuidas de manera irregular"
    },
    {
      "mineral": "Materia organica",
      "pct": "20",
      "texturas": "",
      "observaciones": "Se observan relictos de pirita en su interior"
    }
  ],
  "esquema": {
    "descripcion": "Dibujo circular (vista de lupa) con bandas verticales anaranjadas irregulares sobre fondo claro.",
    "escala": "",
    "imagen": ""
  },
  "ensambles_alteracion": [
    {
      "mineral": "Pirita",
      "pct": "30",
      "intensidad": "moderada",
      "observaciones": ""
    }
  ],
  "secuencia_paragenetica": {
    "descripcion": "Pirita primero y materia organica despues.",
    "eventos": [
      {
        "mineral": "Pirita",
        "etapa": "",
        "notas": ""
      },
      {
        "mineral": "Materia organica",
        "etapa": "",
        "notas": ""
      }
    ]
  },
  "interpretacion": {
    "protolito": "Roca sedimentaria",
    "alteraciones": "Anaerobia (sin presencia de oxigeno)",
    "condiciones_fq": "Temperaturas bajas; pH neutro (7)",
    "tipo_yacimiento": "Porfido"
  },
  "confianza": "alta",
  "notas_transcripcion": "Escaneo de hoja manuscrita, leido con vision. Cada muestra ocupa dos paginas (anverso con las secciones 1-3 y reverso con las 4-6), pero el PDF NO las trae consecutivas: el emparejamiento se reconstruyo por contenido. El campo 'pagina' apunta al anverso (el que lleva el codigo) y es la imagen guardada en page.jpg. Reverso de esta muestra: pagina 10. La tabla de venillas esta vacia. La observacion de la tabla 1 se sale del margen derecho de la hoja escaneada."
}
